{
  "type": "acceptance",
  "schemaVersion": 1,
  "invitationId": "capIdCAPIDcapIdCAPIDcapIdCAPIDcapIdCAPID",
  "accepterDeviceKeyId": "f6e5d4c3b2a1f6e5d4c3b2a1f6e5d4c3b2a1f6e5d4c3b2a1f6e5d4c3b2a1f6e5",
  "accepterPublicKey": {
    "kty": "EC",
    "crv": "P-256",
    "x": "QRSTUVWXYZabcdefghijklmnopQRSTUVWXYZabcdefg",
    "y": "poNMLKJIHGFEDCBAzyxwvutsrqponMLKJIHGFEDCBAz"
  },
  "proofDigest": "4e95c182f4eee6b576b217e961eb0316",
  "createdAt": 1700000010,
  "expiresAt": 1700000910,
  "signature": "ABCDEFGHIJKLMNOPQRSTUVWXYZabcdefghijklmnopqrstuvwxyz0123456789_-ABCDEFGHIJKLMNOPQRSTUV"
}
